Company Name,Brand,Website,Domain
Raytheon Aircraft Company, Hawker Beechcraft, www.raytheonaircraft.com,@raytheonaircraft.com
Aviat Aircraft Inc., Husky, www.aviataircraft.com ,@aviataircraft.com
Flight Design GmbH, CT Series, www.flightdesign.com ,@flightdesign.com
Epic Aircraft LLC, Epic, www.epicaircraft.com ,@epicaircraft.com
Cirrus Design Corporation, SR Series, www.cirrusdesign.com ,@cirrusdesign.com
Maule Air, Inc., M Series,@MSeries
Lancair International, Evolution, www.lancair.com ,@lancair.com
American Champion Aircraft Corp., Champ, www.amerchampionaircraft.com ,@amerchampionaircraft.com
Glasair Aviation LLC, GlaStar & Sportsman 2+2, www.glasairaviation.com ,@glasairaviation.com
Diamond Aircraft Industries, DA-40, www.diamondair.com ,@diamondair.com
Future Flight LLC, Voyager, www.futureflight.org,@futureflight.org
Precision Aircraft Solutions, STOL CH 701, www.stolch701.com,@stolch701.com
AirCrft Labs LLC, Hawk, www.aircraftl,@aircraftl
Gulfstream Aerospace, G650, https://www.gulfstream.com/,@gulfstream.com
Cessna Aircraft Company, Citation CJ4, https://www.cessna.txtav.com/,@cessna.txtav.com
Daher-Socata, TBM 900, http://www.daher.com/,@daher.com
Beechcraft, King Air, http://www.beechcraft.txtav.com/,@beechcraft.txtav.com
Bell Helicopter, Bell 505 Jet Ranger X, http://www.bellhelicopter.com/,@bellhelicopter.com
Pilatus Aircraft, PC-12, https://www.pilatus-aircraft.com/en/pilatus/home/,@pilatus-aircraft.com
Dassault Aviation, Falcon 8X, http://www.dassault-aviation.com/en/,@dassault-aviation.com
Kodiak Aircraft, Kodiak 100, https://www.kodiakaircraft.com/,@kodiakaircraft.com
Embraer Executive Aircraft, Legacy 500, http://www.embraer.com/en-us/executive-jets,@embraer.com
