Company Name,Brand,Website,Domain
Marshall Paper Tube & Core Co., Inc., www.marshallpapertube.com ,@marshallpapertube.com
Salazar Packaging, Inc., www.salazarpackaging.com ,@salazarpackaging.com
Park Paper & Box Co., Inc., www.parkpaperandbox.com ,@parkpaperandbox.com
IPS Packaging, LLC., www.ipack.com ,@ipack.com
Veritiv Corporation, Alliance Packaging, www.veritivcorp.com ,@veritivcorp.com
Pratt Industries, Creative Packaging Solutions, www.prattindustries.com,@prattindustries.com
U-Haul International, U-Haul, www.uhaul.com,@uhaul.com
Sonoco Products Company, Performance Packaging, www.sonoco.com,@sonoco.com
Neenah Packaging, Creas Filament Kraft, www.neenahpackaging.com,@neenahpackaging.com
Menasha Packaging Company, Menasha Packaging, www.menashapackaging.com ,@menashapackaging.com
Georgia-Pacific, Bo-Pack, www.gppackaging.com ,@gppackaging.com
GloPak Corporation, The Cardboard Box Specialists, www.glopakcorp.com ,@glopakcorp.com
Imperial Dade, Speedpak, www.imperialdade.com,@imperialdade.com
International Paper, Top Flight, www.internationalpaper.com,@internationalpaper.com
