Company Name,Brand,Website,Domain
SLI Global Solutions, LLC, www.sliglobalsolutions.com,@sliglobalsolutions.com
Groff  Associates, LLC, www.groffassociates.com,@groffassociates.com
Kuzmak Financial, LLC, www.kuzmakfinancial.com,@kuzmakfinancial.com
Corridor Capital, LLC, www.corridorcapital.com,@corridorcapital.com
BlueStem Partners, LP, www.bluestempartners.com,@bluestempartners.com
Englewood Associates, Inc., www.englewoodassociates.com,@englewoodassociates.com
York Imperial Business Solutions, Inc., www.yorkimperial.com,@yorkimperial.com
Stratagem Capital Group, LLC, www.stratagemcapital.com,@stratagemcapital.com
Bushwick Group, LLC, www.bushwickgroup.com,@bushwickgroup.com
Horizon Transaction Services, LLC, www.horizontransactionservices.com,@horizontransactionservices.com
