Company Name,Brand,Website,Domain
Lincoln International, Investment Banking, www.lincolninternational.com,@lincolninternational.com
The M&A Advisor, Financial Advisory,  www.maadvisor.com,@maadvisor.com
Oppenheimer & Co., Investment Banking, www.opco.com,@opco.com
Maxim Group, Investment Banking, www.maximgrp.com,@maximgrp.com
KippsDesanto & Co., Investment Banking, www.kippsdesanto.com,@kippsdesanto.com
BMO Capital Markets, Investment Banking, www.bmocm.com,@bmocm.com
SunTrust Robinson Humphrey, Investment Banking, www.strh.com,@strh.com
Evercore, Investment Banking, www.evercore.com,@evercore.com
Carl Marks Advisory Group, Financial Advisory, www.carlmarksadvisory.com,@carlmarksadvisory.com
Moelis & Company, Investment Banking, www.moelis.com,@moelis.com
William Blair, Investment Banking, www.williamblair.com,@williamblair.com
Lazard, Investment Banking, www.lazard.com,@lazard.com
Perella Weinberg Partners, Investment Banking, www.pwpartners.com,@pwpartners.com
BDT & Company, Investment Banking, www.bdt.com,@bdt.com
