Company Name,Brand,Website,Domain
Big Commerce, Television spot production, http://bigcomm.com,@bigcomm.com
Reel Feel Advertising, TV advertising, https://www.reefeel.tv,@reefeel.tv
Sparkfactor Creative, TV advertising creative production, https://www.sparkfactorsf.com,@sparkfactorsf.com
Drop Creative, TV ad production and media buying, https://www.dropcreative.co,@dropcreative.co
Adventure Advertising, Television commercial production, http://www.adventureadvertising.com,@adventureadvertising.com
AW Creative, Television Commercial Production, https://www.awcreative.co,@awcreative.co
InFrame Productions, Television Commercial Production, http://www.inframeproductions.com,@inframeproductions.com
Firehouse Productions, Television Commercial Production, http://www.firehouseproductions.com,@firehouseproductions.com
The Sweet Spot Productions, Television Commercial Production, https://www.sweetspotpro.com,@sweetspotpro.com
Revelation Productions, Television Commercial Production, https://www.revproductions.com,@revproductions.com
Think Box Media Group, Television Commercial Production, https://www.thinkboxmedia.net,@thinkboxmedia.net
Wizzard Media, Television Commercial Production, https://www.wizzard.tv,@wizzard.tv
RT Creative Group, Television Commercial Production, https://www.,@
